[
    {
        "id": "<redacted-id>",
        "original-phone": "<redacted-phone>",
        "phone-city-code": "<redacted-phone>",
        "phone-country-code": "<redacted-phone>",
        "phone-extension": "<redacted-phone>",
        "phone-number": "<redacted-phone>",
        "quality-code": "GOOD"
    }
]
